{
  "$schema": "https://json-schema.org/draft/2020-12/schema",
  "$id": "https://raw.githubusercontent.com/DjobaDELATV/seygo_data/main/schema/v1/set.json",
  "title": "Set",
  "description": "A set of Yu-Gi-Oh cards. Sets may be physical (booster pack, structure deck, promo card list, etc) or virtual (Master Duel pack, etc).",
  "type": "object",
  "required": [
    "$schema",
    "id",
    "name",
    "contents",
    "externalIDs"
  ],
  "properties": {
    "$schema": {
      "const": "https://raw.githubusercontent.com/DjobaDELATV/seygo_data/main/schema/v1/set.json"
    },
    "id": {
      "description": "The UUID of this set. The name of the set's file should be this UUID.",
      "type": "string",
      "format": "uuid"
    },
    "date": {
      "description": "The release date for this product, if known. Only used in virtual sets.",
      "type": "string",
      "format": "date"
    },
    "name": {
      "description": "A mapping of language to set names. In physical sets, if the locales object has a mapping for this language, then this name is official, else it is unofficial.",
      "type": "object",
      "propertyNames": {
        "$ref": "https://raw.githubusercontent.com/DjobaDELATV/seygo_data/main/schema/v1/language.json"
      },
      "additionalProperties": {
        "type": "string"
      }
    },
    "locales": {
      "description": "A mapping of locale to locale-specific information. Only used in physical sets.",
      "type": "object",
      "propertyNames": {
        "$ref": "https://raw.githubusercontent.com/DjobaDELATV/seygo_data/main/schema/v1/locale.json"
      },
      "remainingProperties": {
        "description": "Locale-specific information for this set.",
        "type": "object",
        "required": [
          "language",
          "cardImages",
          "externalIDs"
        ],
        "properties": {
          "language": {
            "description": "The default language for this product. Individual cards may have different languages.",
            "type": "string"
          },
          "prefix": {
            "description": "The card code prefix for this locale. This should be everything before the number part of the card code. This includes the dash, if no language code is present! If null, indicates that this locale did not use card codes at all, a la old OCG sets.",
            "type": "string"
          },
          "date": {
            "description": "The release date for this product, if known.",
            "type": "string",
            "format": "date"
          },
          "image": {
            "description": "A URL to a image of this set in this locale, if available. Use this in preference to the 'image' field in 'contents'.",
            "type": "string",
            "format": "uri"
          },
          "boxImage": {
            "description": "A URL to a image of this set's booster box in this locale, if available. Use this in preference to the 'image' field in 'contents'. Deprecated; find the sealed product with the boxOf property set to this instead.",
            "type": "string",
            "format": "uri",
            "deprecated": true
          },
          "cardImages": {
            "description": "A mapping of editions (as per the edition enumeration, or the empty string if no edition) to sets of card images in this locale. Deprecated, use 'cardInfo' instead.",
            "type": "object",
            "additionalProperties": {
              "description": "A mapping of printing UUIDs to images of that card's specific printing in this locale.",
              "type": "object",
              "additionalProperties": {
                "description": "A URL to a full image of this card.",
                "type": "string",
                "format": "uri"
              }
            },
            "deprecated": true
          },
          "cardInfo": {
            "description": "A mapping of editions (as per the edition enumeration, or the empty string if no edition) to per-card information in this locale.",
            "type": "object",
            "additionalProperties": {
              "description": "A mapping of printing UUIDs to per-card info in this locale.",
              "type": "object",
              "additionalProperties": {
                "type": "object",
                "description": "Per-card information for this specific locale.",
                "additionalProperties": {
                  "image": {
                    "type": "string",
                    "description": "The URL to the full card image for this printing.",
                    "format": "uri"
                  },
                  "price": {
                    "type": "number",
                    "description": "Price information for this printing, if available. All prices are the most recent available as of the creation of this database, and are normalized to USD. No guarantees are made that this price is accurate, or that all sources were considered, or that the correct locale was considered."
                  }
                }
              }
            }
          },
          "editions": {
            "description": "A list of editions this set was printed in in this locale.",
            "type": "array",
            "items": {
              "description": "An edition. Duel Terminal editions are limited editions.",
              "enum": [
                "1st",
                "unlimited",
                "limited"
              ]
            }
          },
          "formats": {
            "description": "A list of formats this set was printed in in this locale.",
            "type": "array",
            "items": {
              "$ref": "https://raw.githubusercontent.com/DjobaDELATV/seygo_data/main/schema/v1/format.json"
            }
          },
          "externalIDs": {
            "description": "IDs and other information, to access this set from various other sites.",
            "type": "object",
            "required": [],
            "properties": {
              "dbIDs": {
                "description": "Any official Yugioh database IDs for this product.",
                "type": "array",
                "items": {
                  "type": "integer",
                  "description": "An official Yugioh database ID for this product."
                }
              }
            }
          }
        }
      }
    },
    "contents": {
      "description": "The contents of this set. These contents might differ by locale. Virtual sets have just one entry here.",
      "type": "array",
      "items": {
        "description": "Information about a set's contents.",
        "type": "object",
        "required": [
          "formats",
          "cards"
        ],
        "properties": {
          "locales": {
            "description": "The locales these contents apply to. Not present in virtual packs.",
            "type": "array",
            "items": {
              "$ref": "https://raw.githubusercontent.com/DjobaDELATV/seygo_data/main/schema/v1/locale.json"
            }
          },
          "formats": {
            "description": "The widest set of formats in which this these contents were printed into. Prefer the locale format list over this.",
            "deprectated": true,
            "type": "array",
            "items": {
              "enum": [
                "ocg",
                "tcg",
                "speed",
                "masterduel",
                "duellinks"
              ]
            }
          },
          "distrobution": {
            "description": "Either a keyword, or the UUID of the distrobution method of this set, if known: was it a pack, deck, promo card, etc. Look it up in the distributions JSON. As for keywords: The keyword 'preconstructed' means to give all cards in order, like a deck.",
            "anyOf": [
              {
                "type": "string",
                "format": "uuid"
              },
              {
                "enum": [
                  "preconstructed"
                ]
              }
            ]
          },
          "packsPerBox": {
            "description": "How many packs are included per booster box. Used only if this is a pack that can come in boxes. Deprecated; find the sealed product with the boxOf property set to this instead.",
            "type": "integer",
            "deprecated": true
          },
          "hasHobbyRetailDifferences": {
            "description": "Set this to true if this pack has hobby and retail booster boxes, and thier contents may differ with regard to thier secret/ultimate rares. Deprecated; find the sealed product with the boxOf property set to this instead.",
            "type": "boolean",
            "deprecated": true
          },
          "editions": {
            "description": "The widest set of editions these contents were printed into. At least one is required in physical TCG (and some OCG) sets. This is not present in virtual sets. Prefer the locale edition list over this.",
            "deprectated": true,
            "type": "array",
            "items": {
              "enum": [
                "1st",
                "unlimited",
                "limited"
              ]
            }
          },
          "image": {
            "description": "A URL to a image of this set, if available. Use the 'image' field in 'locales' first if also available.",
            "type": "string",
            "format": "uri"
          },
          "boxImage": {
            "description": "A URL to a image of this set's booster box, if available. Use the 'image' field in 'locales' first if also available. Deprecated; find the sealed product with the boxOf property set to this instead.",
            "type": "string",
            "format": "uri",
            "deprecated": true
          },
          "cards": {
            "description": "Cards in this set.",
            "type": "array",
            "items": {
              "$ref": "https://raw.githubusercontent.com/DjobaDELATV/seygo_data/main/schema/v1/printing.json"
            }
          },
          "removedCards": {
            "description": "Cards that were in this set, but have been removed. Used only in virtual sets.",
            "type": "array",
            "items": {
              "$ref": "https://raw.githubusercontent.com/DjobaDELATV/seygo_data/main/schema/v1/printing.json"
            }
          },
          "externalIDs": {
            "description": "IDs and other information, to access this card from various other sites.",
            "type": "object",
            "required": [],
            "properties": {
              "ygoprodeck": {
                "description": "The slug for YGOPRODECK you can use after 'ygoprodeck.com/pack/' to get the set's page.",
                "type": "string"
              }
            }
          },
          "history": {
            "description": "Physical sets have a release date. Virtual sets, furthermore, may also be revoked, and even re-added, at Konami's whim. This array of periods of availability tracks both.",
            "type": "array",
            "items": {
              "description": "A span of time this set was (or is, or will be) available.",
              "type": "object",
              "required": [],
              "properties": {
                "startDate": {
                  "description": "The date this set was made available. Optional, if you don't know when it debuted.",
                  "type": "string",
                  "format": "date"
                },
                "endDate": {
                  "description": "The date this set was revoked. Optional, if it is still available.",
                  "type": "string",
                  "format": "date"
                }
              }
            }
          }
        }
      }
    },
    "externalIDs": {
      "description": "IDs and other information, to access this set from various other sites.",
      "type": "object",
      "required": [],
      "properties": {
        "yugipedia": {
          "description": "Yugipedia information about this set.",
          "type": "object",
          "required": [
            "id",
            "name"
          ],
          "properties": {
            "id": {
              "description": "The internal wiki ID for the Yugipedia page for this set.",
              "type": "integer"
            },
            "name": {
              "description": "The Yugipedia page name for this set.",
              "type": "string"
            }
          }
        },
        "yugiohpricesName": {
          "description": "The name of this set on YugiohPrices. TCG only. Deprecated; YugiohPrices no longer exists.",
          "type": "string",
          "deprecated": true
        }
      }
    }
  }
}
