{
  "$schema": "https://raw.githubusercontent.com/DjobaDELATV/seygo_data/main/schema/v1/set.json",
  "id": "32a33531-dcb5-4669-a32c-4785d377f5db",
  "date": "2025-07-07",
  "name": {
    "en": "Deck Build Box: Buster Assault"
  },
  "contents": [
    {
      "formats": [
        "duellinks"
      ],
      "image": "https://ms.yugipedia.com//2/21/DeckBuildBoxBusterAssault.png",
      "cards": [
        {
          "id": "243dfa85-26b7-4c4a-a7e9-b6154a58a9ff",
          "card": "da30cc79-106a-43e6-9412-2a405869b8f3"
        },
        {
          "id": "a8044b6c-ce3c-4ce7-800b-87149cc4f337",
          "card": "90293308-7da6-4ed2-afa5-a5236a33b12f"
        },
        {
          "id": "78406d1a-f0a9-451a-a27b-26b53762687c",
          "card": "4a50e7a8-1f9e-4c99-85f9-8d5cc4e00401"
        },
        {
          "id": "9e0dd1a5-d9c2-4739-a04a-36213c49dea0",
          "card": "8ea75a70-ac3b-4c9a-8808-67501613da58"
        },
        {
          "id": "dc924144-7c4e-4ccb-90f4-dddf83d82056",
          "card": "0a77d78a-ea91-4362-a92d-daa03cc9d137"
        },
        {
          "id": "dca803cb-9086-4934-924d-e8b93344b17a",
          "card": "4afbab66-9d0f-46c5-9f67-cefb6280c06c"
        },
        {
          "id": "3af335aa-40d4-48dd-9ad5-dbb99078c444",
          "card": "3b528d5f-89a6-43e3-b5d2-8d9c74ee548b"
        },
        {
          "id": "d5ef7d44-e62c-460a-8865-e20cf6d88c29",
          "card": "b981bd29-e837-43b0-aae0-2d029e346949"
        },
        {
          "id": "1ef01a8e-5998-47fe-bd6b-d81f5eb72363",
          "card": "effa37ff-f099-4496-908f-8225cad719cb"
        },
        {
          "id": "10eb1d0d-9c55-4a56-8254-7828a3161158",
          "card": "afd6d9be-9b8e-4c31-90a9-e71674a97492"
        },
        {
          "id": "e453558b-d661-4abe-8248-4561f441ad5b",
          "card": "626245d3-eb77-41f6-b91c-fbf8f990df89"
        },
        {
          "id": "3f71832d-b8b0-4a9c-ac44-8b1a90022a42",
          "card": "e2adc868-1923-44be-992a-a50f828b8890"
        },
        {
          "id": "2de5f055-250f-4304-8bb3-b032963d2942",
          "card": "6e0d3c52-ea36-4712-b248-1861f229ac6d"
        },
        {
          "id": "42fe61ef-1e9e-4265-962a-61fbc2782c0c",
          "card": "212320d0-e09f-46c4-89bf-62c0dd04a30f"
        },
        {
          "id": "a33176a4-2258-4fc1-94e2-ed92e68cfaaa",
          "card": "69b38dae-d222-4dee-a4a9-82af0787663d"
        },
        {
          "id": "2582ba54-8387-48ca-a2f4-95b7a0174476",
          "card": "0fe43d09-758c-49dd-a25c-662355974e54"
        },
        {
          "id": "aaa86054-e363-49be-9bd4-d760bd28fbaa",
          "card": "a21a1fe2-d992-4013-bcf8-19968c3409da"
        },
        {
          "id": "4849b086-b839-4275-9d96-7e4c977a5847",
          "card": "a01e419c-adcb-47e9-800a-398867794eed"
        },
        {
          "id": "56a93bdc-90e4-4092-b6f9-e694a7afc343",
          "card": "ab6fdab4-ae5e-4b8d-b844-1b1a5da8dcaf"
        },
        {
          "id": "50f7598e-fdec-4a19-957f-05f301d97119",
          "card": "03c24ede-afb7-429a-b25b-7833f29bf946"
        },
        {
          "id": "0aad2ff4-7f9a-49e2-84a0-6c9967d182b2",
          "card": "2727e96b-311f-43d6-9326-9dd4f44b9796"
        },
        {
          "id": "ce6067a9-7a32-4591-a726-ebe282c8aabd",
          "card": "55977ecd-30b7-445c-84f6-ace253572288"
        },
        {
          "id": "118abe69-1b16-49c5-af5b-769a145f91d0",
          "card": "7337dade-5ea7-44f4-8f13-73b7dcbd8677"
        },
        {
          "id": "223de8bb-d696-4dc2-bc31-ba957f4d605f",
          "card": "b7806531-b3f9-4841-a311-e12ac84c5632"
        },
        {
          "id": "f8ebe9cd-8b86-46eb-971c-4309d1381d48",
          "card": "fb5370cc-96f2-4465-9ea6-c6ad31a08f50"
        },
        {
          "id": "cd6099d5-e6cf-4e21-8736-08c021b70c5c",
          "card": "2a527770-1cce-4e44-8dda-0aeba0cdcb86"
        },
        {
          "id": "b1ae4e7d-8338-4c42-a296-aa8c73b8f95a",
          "card": "01fdad9d-76db-4986-88de-6b79960e1779"
        },
        {
          "id": "7d386f3f-20d7-45e0-a1ad-54b7417ee45d",
          "card": "da22a76b-7f7f-4156-9523-4c5fd210fcf1"
        },
        {
          "id": "201388e8-d7e8-4293-b771-1e78199a1f99",
          "card": "ec4a59cb-cebf-4456-a40c-e3ca6fed0455"
        },
        {
          "id": "b6a5fa70-bdb7-4380-8b93-42418f515510",
          "card": "0a69fd52-e4fd-4db8-8483-17222d323990"
        },
        {
          "id": "36aa59ae-3aaf-41ff-b234-f07b703e1a64",
          "card": "5056d3f1-2e7c-4047-bd68-3c1025151c26"
        },
        {
          "id": "8393be6f-7f0d-4fc0-9edc-b8821537654c",
          "card": "f347186c-f2d9-4130-8a7b-9624ec227805"
        },
        {
          "id": "81dd3c27-1a00-427e-bc05-fdb7c84930c5",
          "card": "9df9fdf3-5356-4e99-8ff8-a4015d983f6c"
        },
        {
          "id": "ccadb4a7-247c-4170-9a4e-93d213050861",
          "card": "4d40b367-b9a7-4084-b9cb-37ef3bf2d4cd"
        },
        {
          "id": "96f9b489-2331-421b-9dd8-745f0c73fe17",
          "card": "da1ea7aa-2091-4dd3-ae97-c184bfa8d940"
        },
        {
          "id": "42fa72ac-a3e0-4db9-8164-b5d323c06bf7",
          "card": "0f0430c0-55fc-46f6-b385-48f7dff5bcbf"
        },
        {
          "id": "71e194d3-52b5-4130-982b-08da405de1c3",
          "card": "61c453cf-c3b7-438a-ab3d-4cb607ef9783"
        },
        {
          "id": "0e7f160c-349b-41b9-8b57-dfeb14479151",
          "card": "2c7838be-4f48-4eee-997e-85fa97d2277c"
        },
        {
          "id": "8f1fbdf5-9ac5-41b9-9838-da726c6e936a",
          "card": "fd9d854c-c770-4c49-a631-9922e6ce45dc"
        },
        {
          "id": "b3507a04-cdd4-4567-b272-1c729adb2f1d",
          "card": "a586f0a0-2482-42df-a2de-777555c81783"
        }
      ],
      "externalIDs": {}
    }
  ],
  "externalIDs": {
    "yugipedia": {
      "name": "Deck Build Box: Buster Assault",
      "id": 1136173
    }
  }
}