{
  "$schema": "https://raw.githubusercontent.com/DjobaDELATV/seygo_data/main/schema/v1/set.json",
  "id": "45c5ff37-bb3b-48b3-8fd8-84f83e31af92",
  "name": {
    "en": "Duelist Card Protector EX: Master of HERO",
    "ja": "\u30c7\u30e5\u30a8\u30ea\u30b9\u30c8\u30ab\u30fc\u30c9\u30d7\u30ed\u30c6\u30af\u30bf\u30fc \uff25\uff38 \uff3b\uff2d\uff41\uff53\uff54\uff45\uff52 \uff4f\uff46 \uff28\uff25\uff32\uff2f\uff3d \u7279\u5178\u30ab\u30fc\u30c9"
  },
  "locales": {
    "jp": {
      "language": "ja",
      "prefix": "DPEX-JP",
      "date": "2014-06-21",
      "image": "https://ms.yugipedia.com//4/41/DPEX002-PromoJP.png",
      "cardImages": {
        "unlimited": {
          "e4a48eeb-df11-4bdd-8e60-5e7d3c910d27": "https://ms.yugipedia.com//c/c9/ElementalHERONovaMaster-DPEX-JP-NPR.png"
        }
      },
      "cardInfo": {
        "unlimited": {
          "e4a48eeb-df11-4bdd-8e60-5e7d3c910d27": {
            "image": "https://ms.yugipedia.com//c/c9/ElementalHERONovaMaster-DPEX-JP-NPR.png"
          }
        }
      },
      "formats": [
        "ocg"
      ],
      "editions": [
        "unlimited"
      ],
      "externalIDs": {
        "dbIDs": [
          111115000
        ]
      }
    }
  },
  "contents": [
    {
      "locales": [
        "jp"
      ],
      "formats": [
        "ocg"
      ],
      "editions": [
        "unlimited"
      ],
      "image": "https://ms.yugipedia.com//4/41/DPEX002-PromoJP.png",
      "cards": [
        {
          "id": "e4a48eeb-df11-4bdd-8e60-5e7d3c910d27",
          "card": "936836e5-cb0e-4146-b95a-75eb19f4ffa4",
          "suffix": "002",
          "rarity": "commonparallel"
        }
      ],
      "externalIDs": {}
    }
  ],
  "externalIDs": {
    "yugipedia": {
      "name": "Duelist Card Protector EX: Master of HERO",
      "id": 314164
    }
  }
}