{
  "$schema": "https://raw.githubusercontent.com/DjobaDELATV/seygo_data/main/schema/v1/set.json",
  "id": "57cf8ab0-012f-45f1-be0f-b139ee6f901a",
  "date": "2022-01-19",
  "name": {
    "en": "Essence of Flora and Ocean"
  },
  "contents": [
    {
      "formats": [
        "masterduel"
      ],
      "image": "https://ms.yugipedia.com//f/f4/Essence_of_Flora_and_Ocean-Pack-Master_Duel.png",
      "cards": [
        {
          "id": "95e82d17-cabf-496b-821e-0cca6c69d65f",
          "card": "8bc42c00-6d87-452b-b026-9ad13b3294d1"
        },
        {
          "id": "42f222e5-1d96-4f5b-b879-46ae127cc7dc",
          "card": "9a20ed60-972a-4520-af7f-bd41d10fb85d"
        },
        {
          "id": "cbaa3ec7-893b-44c3-8942-fa4a12392163",
          "card": "2f361dfd-1c37-4bfe-9667-51358c78064f"
        },
        {
          "id": "2ce1499d-02fb-4c2e-a1a0-1f1c0f958ea2",
          "card": "e5b68ca9-e5fb-4c62-bb9a-1952036bc454"
        },
        {
          "id": "0ef088a3-4511-416a-9b0f-c09c8619c1f4",
          "card": "50571601-df56-42e2-b2a5-c601d308e102"
        },
        {
          "id": "e986baba-d7c2-448c-be2b-cfc680c28645",
          "card": "e1857134-947d-41a2-b456-687f66031d7a"
        },
        {
          "id": "d626d7a1-99ec-4327-a2d1-825be1668772",
          "card": "f242f50c-6897-4451-80cd-2015f850c741"
        },
        {
          "id": "c1468f4e-d74a-4b31-b8ec-cdfb922b850a",
          "card": "fef8f6c9-8b92-4566-86c3-4f1b9999583d"
        },
        {
          "id": "7068c360-a262-4809-83de-a95d3245178a",
          "card": "949d24de-b797-4526-a9c0-b7bc7210d442"
        },
        {
          "id": "4468bae2-25f2-4b2d-b18e-8b2c339293fa",
          "card": "010eb61d-34fc-4bd8-be2f-1bb2e942ac48"
        },
        {
          "id": "c16baed0-bc69-46fa-8d0c-e6d377f0984e",
          "card": "2b5145c5-74ad-44c8-9df2-ba720874604a"
        },
        {
          "id": "5a6db4ff-f88c-40a4-93b0-568b9049489b",
          "card": "9dcb6990-bae0-4308-81f4-51dbe5ad6b31"
        },
        {
          "id": "5fe6f12f-d901-41ef-b682-1ac4b9f59b0b",
          "card": "1a968672-28fb-492f-be4c-13f0125745d7"
        },
        {
          "id": "284c1dde-b109-44e8-96d9-018f95e21eb4",
          "card": "90076f2b-04b7-4039-bbc5-a6a9dc0f4947"
        },
        {
          "id": "67cc84fd-325c-4c32-884c-48c2b9266eb3",
          "card": "b06a2803-fe69-4849-8b70-5fd157b3d932"
        },
        {
          "id": "8c4f8c41-3481-447d-857d-d76f60dc85b2",
          "card": "ded7f530-c103-4186-9848-2869da89ba1a"
        },
        {
          "id": "d4679886-9909-4b29-ae9a-79e29970ac19",
          "card": "cefce943-c70f-46e7-b44d-235bbe26acd4"
        },
        {
          "id": "60bdb628-de0f-4cae-8e25-2de5b6b8de59",
          "card": "ca18231f-dac3-487c-b6ba-4ad21fcc2df1"
        },
        {
          "id": "1fdb0c0f-79ba-4430-a609-94ac9b8a0a90",
          "card": "70aed5af-626b-4ed6-ba95-14ba88243711"
        },
        {
          "id": "cddbe04f-94bd-44de-af66-4457d5af5cc2",
          "card": "8e175742-9d79-4964-a3e3-3730647e8397"
        },
        {
          "id": "c8bcb4f4-8ea2-4f6c-856c-2fcb27b3aae2",
          "card": "72edc12b-b8f8-46ad-b305-3fb48540920d"
        },
        {
          "id": "386821e7-0418-4a0c-9fe2-39416e4c35d1",
          "card": "2e006836-41ea-401a-9be8-3bb0c2044979"
        },
        {
          "id": "850659da-70cf-41a8-a12d-538afeb25bb4",
          "card": "9b9b0cbc-e80d-460d-8196-a6f6ab9c72fb"
        },
        {
          "id": "47604126-f261-47d7-9981-6a0b3b03bade",
          "card": "02e533f8-b99f-4f77-bac7-290735b2469f"
        },
        {
          "id": "6ae6cd9b-f8b2-41e5-9dee-7cbf48fc0817",
          "card": "a622762c-8885-47b3-b4a2-b9398b076782"
        },
        {
          "id": "a96389e9-1e0b-495d-a04d-6a338d20afd3",
          "card": "2c500121-c3e1-46c9-900e-6d4c60f2be8b"
        },
        {
          "id": "55adfdf8-adf5-4592-929b-23cfba05487d",
          "card": "ed7fcd01-cf3d-4af5-9f06-52adb492cabf"
        },
        {
          "id": "34e0dcc5-08b7-4700-883c-01b9ebb5ed28",
          "card": "6f6ff397-4caa-4e4b-ab18-ac0b1984861e"
        },
        {
          "id": "effdbde6-9978-47ae-9997-3461a174e722",
          "card": "077532e9-db06-49b0-9380-b49654d44afd"
        },
        {
          "id": "809e7cbb-3b15-48e2-b73d-881dc7b05f22",
          "card": "958a772a-7ea2-43a9-855b-ec77c24a9782"
        },
        {
          "id": "2f97a312-a103-4299-b2da-4992b963e0db",
          "card": "70953206-82c7-4b1e-aacf-70a3fb69135a"
        },
        {
          "id": "a1621bf1-4682-4031-9176-131b14f5bd67",
          "card": "f288082f-463d-4ddc-8f24-86a885925c66"
        },
        {
          "id": "462bca09-bb28-46a1-9a79-f850467f5b0d",
          "card": "d8efc223-f63e-4321-9d4c-396d942ef537"
        },
        {
          "id": "27b3fd1f-5988-4d59-b299-9bffde047441",
          "card": "71fd65a2-a3b7-4b07-98da-c41322be389e"
        },
        {
          "id": "3673d25d-37b9-407d-97f9-5568bda9e5b2",
          "card": "8961cd53-9a60-4d4f-bc56-6f0c59f5aa21"
        },
        {
          "id": "3ec70d7a-9433-455e-87db-a436cef244fa",
          "card": "70622885-a9a7-4f32-99ba-6994a3a3eda8"
        },
        {
          "id": "4cb2546c-0224-4b38-903c-011a4c833817",
          "card": "d730d189-ff0c-4558-a072-ec003b795ac3"
        },
        {
          "id": "1588017b-ca89-4128-ba9a-2710354468bc",
          "card": "08b511ce-ecbc-4a2d-b03e-62b3f9617250"
        },
        {
          "id": "4349175a-51b0-46a1-b109-27a87e779dc5",
          "card": "8a56fe04-8d31-47de-820b-ebbdb9318fda"
        },
        {
          "id": "841b7b08-c4b4-42a3-9f58-b9d4700d1f31",
          "card": "b7c3f631-8775-44e1-8940-0a7854c17f96"
        },
        {
          "id": "bb01798c-2ba9-4916-aa43-f840103dc7c0",
          "card": "75c682e7-c26e-4e06-80e3-eea6c0decf50"
        },
        {
          "id": "c31e8261-ac47-42cb-8cac-3a6a61a33b89",
          "card": "0280e055-97f7-4c61-8777-3cedd64d572a"
        },
        {
          "id": "c2b4ca2f-d655-44c8-9e2e-77899ebce944",
          "card": "edbde91e-b234-418c-8668-df3e5cc666fd"
        },
        {
          "id": "3a93b451-cc18-4046-8ba4-17f14c9be4ea",
          "card": "4dfb0608-99f7-4377-8a05-c0ebc603d33a"
        },
        {
          "id": "de08dd63-49e7-43a1-adcb-53074b0fe6d4",
          "card": "b34c64d7-8c0c-4f12-a893-f99fc8bd8400"
        },
        {
          "id": "3a965008-0d47-435e-a326-9cb1b976b1a7",
          "card": "efc32683-8c69-4372-b39f-b8861ff5bd7e"
        },
        {
          "id": "5601664a-e172-43cd-8321-0cad65c0b433",
          "card": "0afb170c-d56f-4aa4-83a6-2dcba8d82839"
        },
        {
          "id": "349822b6-f1b4-48c1-a8bf-9e26a8b14eb4",
          "card": "4b1d8c7b-8453-496b-bdd0-5fe89c7f9a41"
        },
        {
          "id": "d3428965-fb61-4bf5-ac44-9f135b001c0f",
          "card": "260b1a31-5ce5-448f-8ee5-a403966ade23"
        },
        {
          "id": "f204d72c-e489-411b-872f-2820fc0d073b",
          "card": "3421a33a-e253-4a41-9f53-1dca78d3a384"
        },
        {
          "id": "9c7f8119-8c09-4c00-89e0-a054951c7403",
          "card": "686d356e-885b-4deb-8db3-05702a93d551"
        },
        {
          "id": "f45fef30-af6a-484a-8d61-26170ec23871",
          "card": "911a51bf-4b5b-40a6-b8c3-60b31591fc72"
        },
        {
          "id": "bd54dabc-60ee-49d5-bc3a-529296d17b99",
          "card": "c19d5040-71f6-4bdb-9f52-0fe3d4ab2941"
        },
        {
          "id": "a7bb3283-d8c3-4709-8e99-be484ea68ba2",
          "card": "0f5250a5-07b5-4966-9750-4068eeb64c56"
        },
        {
          "id": "4953b70f-805a-474f-a18d-1c03a58a3462",
          "card": "b902d48a-3884-4f04-902b-902b83e573d4"
        }
      ],
      "externalIDs": {}
    }
  ],
  "externalIDs": {
    "yugipedia": {
      "name": "Essence of Flora and Ocean",
      "id": 904023
    }
  }
}