{
  "$schema": "https://raw.githubusercontent.com/DjobaDELATV/seygo_data/main/schema/v1/set.json",
  "id": "8e510c35-4128-4e1b-952c-740ae8b7d86e",
  "name": {
    "en": "Yu-Gi-Oh! Duel Monsters Expert 3 promotional cards",
    "ja": "\u904a\u622f\u738b\u30c7\u30e5\u30a8\u30eb\u30e2\u30f3\u30b9\u30bf\u30fc\u30ba \u30a8\u30ad\u30b9\u30d1\u30fc\u30c8\uff13 \u540c\u68b1\u30ab\u30fc\u30c9"
  },
  "locales": {
    "jp": {
      "language": "ja",
      "prefix": "EX3-",
      "date": "2004-02-05",
      "image": "https://ms.yugipedia.com//archive/f/f9/20241215144526%21EX3-VideoGame-JP.png",
      "cardImages": {
        "unlimited": {
          "cc34a9bf-8599-4b8e-a65c-1bee7922f7db": "https://ms.yugipedia.com//b/bd/EmestheInfinity-EX3-JP-UR.jpg",
          "4ac7e4e6-ced3-4e5b-90cf-caaf265c6685": "https://ms.yugipedia.com//9/96/DDAssailant-EX3-JP-UR.jpg",
          "43a32cda-ffb9-4266-a2cf-b84af63aed32": "https://ms.yugipedia.com//9/9f/TwinheadedBeast-EX3-JP-UR.jpg"
        }
      },
      "cardInfo": {
        "unlimited": {
          "cc34a9bf-8599-4b8e-a65c-1bee7922f7db": {
            "image": "https://ms.yugipedia.com//b/bd/EmestheInfinity-EX3-JP-UR.jpg"
          },
          "4ac7e4e6-ced3-4e5b-90cf-caaf265c6685": {
            "image": "https://ms.yugipedia.com//9/96/DDAssailant-EX3-JP-UR.jpg"
          },
          "43a32cda-ffb9-4266-a2cf-b84af63aed32": {
            "image": "https://ms.yugipedia.com//9/9f/TwinheadedBeast-EX3-JP-UR.jpg"
          }
        }
      },
      "formats": [
        "ocg"
      ],
      "editions": [
        "unlimited"
      ],
      "externalIDs": {
        "dbIDs": [
          151505000
        ]
      }
    }
  },
  "contents": [
    {
      "locales": [
        "jp"
      ],
      "formats": [
        "ocg"
      ],
      "editions": [
        "unlimited"
      ],
      "image": "https://ms.yugipedia.com//archive/f/f9/20241215144526%21EX3-VideoGame-JP.png",
      "cards": [
        {
          "id": "cc34a9bf-8599-4b8e-a65c-1bee7922f7db",
          "card": "3f58a7be-00a9-4067-b2ec-ee350f084d20",
          "suffix": "001",
          "rarity": "ultra"
        },
        {
          "id": "4ac7e4e6-ced3-4e5b-90cf-caaf265c6685",
          "card": "c9a86b69-1ca6-4545-8360-de4afa21c3c7",
          "suffix": "002",
          "rarity": "ultra"
        },
        {
          "id": "43a32cda-ffb9-4266-a2cf-b84af63aed32",
          "card": "8dc5bcf1-dcd3-456f-a967-37998d2ae27c",
          "suffix": "003",
          "rarity": "ultra"
        }
      ],
      "externalIDs": {}
    }
  ],
  "externalIDs": {
    "yugipedia": {
      "name": "Yu-Gi-Oh! Duel Monsters Expert 3 promotional cards",
      "id": 7090
    }
  }
}