{
  "$schema": "https://raw.githubusercontent.com/DjobaDELATV/seygo_data/main/schema/v1/set.json",
  "id": "517ede74-f1c0-47dd-ae11-aeb181411fad",
  "name": {
    "en": "Limited Edition 13",
    "ja": "\uff2c\uff29\uff2d\uff29\uff34\uff25\uff24 \uff25\uff24\uff29\uff34\uff29\uff2f\uff2e \uff11\uff13"
  },
  "locales": {
    "jp": {
      "language": "ja",
      "prefix": "LE13-JP",
      "date": "2008-06-21",
      "image": "https://ms.yugipedia.com//b/b4/LE13-BoosterJP.jpg",
      "cardImages": {
        "unlimited": {
          "63fa096c-df5b-434d-a30a-e21dc0ef29c7": "https://ms.yugipedia.com//3/3a/GenexNeutron-LE13-JP-DUPR-DT.png",
          "44b79f08-c134-4d4d-acfb-504786208918": "https://ms.yugipedia.com//d/d2/AllyofJusticeCycloneCreator-LE13-JP-DUPR-DT.png",
          "d0b0a7f1-a7c6-4bf8-93e9-767f8babc7a0": "https://ms.yugipedia.com//a/a5/FabledRaven-LE13-JP-DUPR-DT.png"
        }
      },
      "cardInfo": {
        "unlimited": {
          "44b79f08-c134-4d4d-acfb-504786208918": {
            "image": "https://ms.yugipedia.com//d/d2/AllyofJusticeCycloneCreator-LE13-JP-DUPR-DT.png"
          },
          "d0b0a7f1-a7c6-4bf8-93e9-767f8babc7a0": {
            "image": "https://ms.yugipedia.com//a/a5/FabledRaven-LE13-JP-DUPR-DT.png"
          },
          "63fa096c-df5b-434d-a30a-e21dc0ef29c7": {
            "image": "https://ms.yugipedia.com//3/3a/GenexNeutron-LE13-JP-DUPR-DT.png"
          }
        }
      },
      "formats": [
        "ocg"
      ],
      "editions": [
        "unlimited"
      ],
      "externalIDs": {
        "dbIDs": [
          121210008
        ]
      }
    }
  },
  "contents": [
    {
      "locales": [
        "jp"
      ],
      "formats": [
        "ocg"
      ],
      "editions": [
        "unlimited"
      ],
      "image": "https://ms.yugipedia.com//b/b4/LE13-BoosterJP.jpg",
      "cards": [
        {
          "id": "63fa096c-df5b-434d-a30a-e21dc0ef29c7",
          "card": "abb7cc8e-9035-493e-89e0-2f58000e9b9e",
          "suffix": "001",
          "rarity": "dtupr"
        },
        {
          "id": "44b79f08-c134-4d4d-acfb-504786208918",
          "card": "21a7b711-7afd-441e-989f-4254a60b0798",
          "suffix": "002",
          "rarity": "dtupr"
        },
        {
          "id": "d0b0a7f1-a7c6-4bf8-93e9-767f8babc7a0",
          "card": "4018c0a4-39c2-457c-bec2-47ad55d3b959",
          "suffix": "003",
          "rarity": "dtupr"
        }
      ],
      "externalIDs": {}
    }
  ],
  "externalIDs": {
    "yugipedia": {
      "name": "Limited Edition 13",
      "id": 27886
    }
  }
}